{
  "$schema": "https://json-schema.org/draft/2020-12/schema",
  "$id": "https://a2dlc.local/contracts/integration.schema.json",
  "title": "Report of Stage 6, Integration (.a2dlc/run/<slice>/integration.json, not committed)",
  "description": "Protocol §5, Stage 6, the part that fits in the provider repo's binary. Declared blast radius: the changed files from base to candidate that match the contracts of each consumer of config.integration. Consumer-driven contract matrix: each affected consumer runs its suite, without network, against the candidate in /work; a red one rejects (escalation consumer_broken). Expand-and-contract: the changed migration files go through the destructive DDL linter (escalation destructive_migration). verdict: PASS if every affected consumer passed and there is no destructive DDL; FAIL if a consumer broke or there is destructive DDL; INCONCLUSIVE if some run could not be judged. Outside the binary: the service graph and the durable contract workflow.",
  "type": "object",
  "properties": {
    "schema_version": { "$ref": "defs.schema.json#/$defs/schema_version" },
    "slice_id": { "$ref": "run-defs.schema.json#/$defs/slice_id" },
    "base_sha": { "type": "string", "pattern": "^[0-9a-f]{40}$" },
    "candidate": {
      "oneOf": [{ "type": "null" }, { "type": "string", "pattern": "^[0-9a-f]{40}$" }],
      "description": "The commit of the candidate left by Stage 3 (the one selected with N=2); null if the working tree was judged."
    },
    "changed_files": { "type": "array", "items": { "type": "string", "minLength": 1 }, "uniqueItems": true },
    "consumers": {
      "type": "array",
      "items": {
        "type": "object",
        "properties": {
          "name": { "type": "string", "pattern": "^[a-z][a-z0-9_.-]{0,63}$" },
          "image": { "type": "string", "minLength": 1 },
          "affected_by": {
            "type": "array", "items": { "type": "string", "minLength": 1 }, "uniqueItems": true,
            "description": "Changed files that match its contracts. Empty with status not_run: nothing of its changed. Empty with another status: the consumer declares no contracts and runs on every slice."
          },
          "status": {
            "description": "passed: its suite green against the candidate. failed: at least one red test (failed_tests). inconclusive: the run could not be judged (reason). not_run: no changed file matches its contracts.",
            "enum": ["passed", "failed", "inconclusive", "not_run"]
          },
          "tests": {
            "type": "object",
            "properties": {
              "passed": { "type": "integer", "minimum": 0 },
              "failed": { "type": "integer", "minimum": 0 }
            },
            "required": ["passed", "failed"],
            "additionalProperties": false
          },
          "failed_tests": { "type": "array", "items": { "type": "string", "minLength": 1 }, "uniqueItems": true },
          "reason": { "type": "string", "minLength": 1 }
        },
        "required": ["name", "image", "affected_by", "status"],
        "additionalProperties": false,
        "allOf": [
          { "if": { "properties": { "status": { "const": "failed" } }, "required": ["status"] }, "then": { "required": ["tests", "failed_tests"], "properties": { "failed_tests": { "minItems": 1 } } } },
          { "if": { "properties": { "status": { "const": "passed" } }, "required": ["status"] }, "then": { "required": ["tests"] } },
          { "if": { "properties": { "status": { "const": "inconclusive" } }, "required": ["status"] }, "then": { "required": ["reason"] } }
        ]
      }
    },
    "migrations": {
      "type": "object",
      "properties": {
        "files": { "type": "array", "items": { "type": "string", "minLength": 1 }, "uniqueItems": true, "description": "Changed files that match config.integration.migrations.paths and went through the linter." },
        "destructive": {
          "type": "array",
          "items": {
            "type": "object",
            "properties": {
              "file": { "type": "string", "minLength": 1 },
              "line": { "type": "integer", "minimum": 1 },
              "rule": { "type": "string", "minLength": 1, "description": "drop_column (also ALTER TABLE … DROP <col> without COLUMN), drop_table, rename, type_change, truncate, or custom:<n> for a config rule. It is a per-statement regular-expression linter (quoted literals excluded), not squawk or atlas over a snapshot: that is left to the platform." },
              "statement": { "type": "string", "minLength": 1 }
            },
            "required": ["file", "line", "rule", "statement"],
            "additionalProperties": false
          }
        }
      },
      "required": ["files", "destructive"],
      "additionalProperties": false
    },
    "discovered": {
      "type": "array",
      "description": "Edges found inside the repo (blast radius): Python imports via AST, TypeScript via the compiler, OpenAPI or protobuf contracts to their clients, and Code Graph Indexer edges (ChronosGraph). Cross-repo consumers stay in config.integration.",
      "items": {
        "type": "object",
        "properties": {
          "from": { "type": "string", "minLength": 1 },
          "to": { "type": "string", "minLength": 1 },
          "via": { "enum": ["import", "openapi", "protobuf", "code_graph"] }
        },
        "required": ["from", "to", "via"],
        "additionalProperties": false
      }
    },
    "blast_radius": {
      "type": "object",
      "description": "Downstream impact and risk score measured by the Code Graph Indexer (ChronosGraph).",
      "properties": {
        "total_impacted": { "type": "integer", "minimum": 0 },
        "ranking": {
          "type": "array",
          "items": {
            "type": "object",
            "properties": {
              "file": { "type": "string", "minLength": 1 },
              "blast_radius": { "type": "integer", "minimum": 0 },
              "risk_score": { "type": "number", "minimum": 0 },
              "high_risk_functions": { "type": "integer", "minimum": 0 }
            },
            "required": ["file", "blast_radius", "risk_score", "high_risk_functions"],
            "additionalProperties": false
          }
        }
      },
      "required": ["total_impacted", "ranking"],
      "additionalProperties": false
    },
    "verdict": { "$ref": "defs.schema.json#/$defs/verdict" }
  },
  "required": ["schema_version", "slice_id", "base_sha", "candidate", "changed_files", "consumers", "migrations", "verdict"],
  "additionalProperties": false
}
